{
  "content_hash": "9c09b4e139525e21e91c2d4a5c8a7e7c062b84a20b0a649ed6b64f57c2f24c54",
  "extensions": [],
  "format": "world-forge.system_module",
  "format_version": 1,
  "module_id": "sports_career_systems",
  "project_id": "sports_career",
  "systems": [
    {
      "asset_binding_ids": [
        "season_dashboard_visual"
      ],
      "effect_ids": [
        "plan_aggressive_match_record",
        "plan_aggressive_match_request_result",
        "plan_balanced_match_record",
        "plan_balanced_match_request_result",
        "record_round_1_draw_advance_career",
        "record_round_1_draw_advance_round",
        "record_round_1_draw_record_opponent",
        "record_round_1_draw_record_result",
        "record_round_1_draw_return_to_planning",
        "record_round_1_draw_update_standings",
        "record_round_1_loss_advance_career",
        "record_round_1_loss_advance_round",
        "record_round_1_loss_record_opponent",
        "record_round_1_loss_record_result",
        "record_round_1_loss_return_to_planning",
        "record_round_1_loss_update_standings",
        "record_round_1_win_advance_career",
        "record_round_1_win_advance_round",
        "record_round_1_win_record_opponent",
        "record_round_1_win_record_result",
        "record_round_1_win_return_to_planning",
        "record_round_1_win_update_standings",
        "record_round_2_draw_advance_career",
        "record_round_2_draw_advance_round",
        "record_round_2_draw_record_opponent",
        "record_round_2_draw_record_result",
        "record_round_2_draw_return_to_planning",
        "record_round_2_draw_update_standings",
        "record_round_2_loss_advance_career",
        "record_round_2_loss_advance_round",
        "record_round_2_loss_record_opponent",
        "record_round_2_loss_record_result",
        "record_round_2_loss_return_to_planning",
        "record_round_2_loss_update_standings",
        "record_round_2_win_advance_career",
        "record_round_2_win_advance_round",
        "record_round_2_win_record_opponent",
        "record_round_2_win_record_result",
        "record_round_2_win_return_to_planning",
        "record_round_2_win_update_standings",
        "record_round_3_draw_advance_career",
        "record_round_3_draw_advance_round",
        "record_round_3_draw_record_opponent",
        "record_round_3_draw_record_result",
        "record_round_3_draw_return_to_planning",
        "record_round_3_draw_update_standings",
        "record_round_3_loss_advance_career",
        "record_round_3_loss_advance_round",
        "record_round_3_loss_record_opponent",
        "record_round_3_loss_record_result",
        "record_round_3_loss_return_to_planning",
        "record_round_3_loss_update_standings",
        "record_round_3_win_advance_career",
        "record_round_3_win_advance_round",
        "record_round_3_win_record_opponent",
        "record_round_3_win_record_result",
        "record_round_3_win_return_to_planning",
        "record_round_3_win_update_standings"
      ],
      "event_ids": [
        "match_planned",
        "match_resolved"
      ],
      "id": "season_standings",
      "precondition_ids": [
        "match_remaining_for_plan_aggressive_match",
        "match_remaining_for_plan_balanced_match",
        "planning_phase_for_plan_aggressive_match",
        "planning_phase_for_plan_balanced_match",
        "result_phase_for_record_round_1_draw",
        "result_phase_for_record_round_1_loss",
        "result_phase_for_record_round_1_win",
        "result_phase_for_record_round_2_draw",
        "result_phase_for_record_round_2_loss",
        "result_phase_for_record_round_2_win",
        "result_phase_for_record_round_3_draw",
        "result_phase_for_record_round_3_loss",
        "result_phase_for_record_round_3_win",
        "round_ready_for_record_round_1_draw",
        "round_ready_for_record_round_1_loss",
        "round_ready_for_record_round_1_win",
        "round_ready_for_record_round_2_draw",
        "round_ready_for_record_round_2_loss",
        "round_ready_for_record_round_2_win",
        "round_ready_for_record_round_3_draw",
        "round_ready_for_record_round_3_loss",
        "round_ready_for_record_round_3_win",
        "schedule_valid_for_record_round_1_draw",
        "schedule_valid_for_record_round_1_loss",
        "schedule_valid_for_record_round_1_win",
        "schedule_valid_for_record_round_2_draw",
        "schedule_valid_for_record_round_2_loss",
        "schedule_valid_for_record_round_2_win",
        "schedule_valid_for_record_round_3_draw",
        "schedule_valid_for_record_round_3_loss",
        "schedule_valid_for_record_round_3_win",
        "team_registered_for_record_round_1_draw",
        "team_registered_for_record_round_1_loss",
        "team_registered_for_record_round_1_win",
        "team_registered_for_record_round_2_draw",
        "team_registered_for_record_round_2_loss",
        "team_registered_for_record_round_2_win",
        "team_registered_for_record_round_3_draw",
        "team_registered_for_record_round_3_loss",
        "team_registered_for_record_round_3_win"
      ],
      "system_type": "season",
      "title": "reach the authored season points target"
    }
  ],
  "title": "Authored league season"
}
